tcpdump -w 0001.pcap -i eth0
tcpdump: listening on eth0, link-type EN10MB (Ethernet), snapshot length 262144 bytes
^C16 packets captured
18 packets received by filter
0 packets dropped by kernel
root@comp3134-lab:~# tcpdump -r 0001.pcap
reading from file 0001.pcap, link-type EN10MB (Ethernet), snapshot length 262144
20:07:24.691011 IP comp3134-lab.ssh > 20.142.158.104.in-addr.arpa.61766: Flags [P.], seq 688267705:688267749, ack 3704301415, win 501, options [nop,nop,TS val 1052629324 ecr 3412677917], length 44
20:07:24.691067 IP comp3134-lab.ssh > 20.142.158.104.in-addr.arpa.61766: Flags [P.], seq 44:96, ack 1, win 501, options [nop,nop,TS val 1052629324 ecr 3412677917], length 52
20:07:24.691135 IP comp3134-lab.ssh > 20.142.158.104.in-addr.arpa.61766: Flags [P.], seq 96:232, ack 1, win 501, options [nop,nop,TS val 1052629324 ecr 3412677917], length 136
20:07:24.691156 IP comp3134-lab.ssh > 20.142.158.104.in-addr.arpa.61766: Flags [P.], seq 232:268, ack 1, win 501, options [nop,nop,TS val 1052629324 ecr 3412677917], length 36
20:07:24.706257 IP 20.142.158.104.in-addr.arpa.61766 > comp3134-lab.ssh: Flags [.], ack 0, win 5552, options [nop,nop,TS val 3412677943 ecr 1052629321], length 0
20:07:24.711233 IP 20.142.158.104.in-addr.arpa.61766 > comp3134-lab.ssh: Flags [.], ack 268, win 5550, options [nop,nop,TS val 3412677948 ecr 1052629324], length 0

20:07:27.615902 IP 178.215.238.225.39517 > comp3134-lab.4153: Flags [S], seq 1465173287, win 65535, length 0
20:07:33.849292 IP 147.185.132.58.55494 > comp3134-lab.943: Flags [S], seq 3723474206, win 65535, options [mss 1460], length 0
20:07:43.782067 IP 159.89.116.167 > comp3134-lab: ICMP echo request, id 23290, seq 0, length 20
20:07:43.782121 IP comp3134-lab > 159.89.116.167: ICMP echo reply, id 23290, seq 0, length 20
20:07:44.782164 IP 159.89.116.167 > comp3134-lab: ICMP echo request, id 23290, seq 1, length 20
20:07:44.782207 IP comp3134-lab > 159.89.116.167: ICMP echo reply, id 23290, seq 1, length 20
20:07:45.782225 IP 159.89.116.167 > comp3134-lab: ICMP echo request, id 23290, seq 2, length 20
20:07:45.782273 IP comp3134-lab > 159.89.116.167: ICMP echo reply, id 23290, seq 2, length 20
20:07:46.784132 IP 159.89.116.167 > comp3134-lab: ICMP echo request, id 23290, seq 3, length 20
20:07:46.784180 IP comp3134-lab > 159.89.116.167: ICMP echo reply, id 23290, seq 3, length 20
