root@comp3134-lab:~# tcpdump -c 5 -i eth0
tcpdump: verbose output suppressed, use -v[v]... for full protocol decode
listening on eth0, link-type EN10MB (Ethernet), snapshot length 262144 bytes
20:04:30.803066 IP comp3134-lab.ssh > 20.142.158.104.in-addr.arpa.61766: Flags [P.], seq 669429345:669429453, ack 3704287587, win 501, options [nop,nop,TS val 1052455436 ecr 3412504028], length 108
20:04:30.803153 IP comp3134-lab.ssh > 20.142.158.104.in-addr.arpa.61766: Flags [P.], seq 108:264, ack 1, win 501, options [nop,nop,TS val 1052455436 ecr 3412504028], length 156
20:04:30.803244 IP comp3134-lab.ssh > 20.142.158.104.in-addr.arpa.61766: Flags [P.], seq 264:332, ack 1, win 501, options [nop,nop,TS val 1052455436 ecr 3412504028], length 68
20:04:30.803274 IP comp3134-lab.ssh > 20.142.158.104.in-addr.arpa.61766: Flags [P.], seq 332:368, ack 1, win 501, options [nop,nop,TS val 1052455436 ecr 3412504028], length 36
20:04:30.817964 IP 20.142.158.104.in-addr.arpa.61766 > comp3134-lab.ssh: Flags [.], ack 0, win 2047, options [nop,nop,TS val 3412504050 ecr 1052455433], length 0
5 packets captured
23 packets received by filter
0 packets dropped by kernel