root@comp3134-lab:~# tcpdump -n -i eth0
tcpdump: verbose output suppressed, use -v[v]... for full protocol decode
listening on eth0, link-type EN10MB (Ethernet), snapshot length 262144 bytes
20:08:53.054550 IP 147.182.153.187.22 > 104.158.142.20.61766: Flags [P.], seq 688271701:688271809, ack 3704301911, win 501, options [nop,nop,TS val 1052717688 ecr 3412766284], length 108
20:08:53.054658 IP 147.182.153.187.22 > 104.158.142.20.61766: Flags [P.], seq 108:264, ack 1, win 501, options [nop,nop,TS val 1052717688 ecr 3412766284], length 156
20:08:53.054697 IP 147.182.153.187.22 > 104.158.142.20.61766: Flags [P.], seq 264:332, ack 1, win 501, options [nop,nop,TS val 1052717688 ecr 3412766284], length 68
20:08:53.054726 IP 147.182.153.187.22 > 104.158.142.20.61766: Flags [P.], seq 332:368, ack 1, win 501, options [nop,nop,TS val 1052717688 ecr 3412766284], length 36
20:08:53.073001 IP 104.158.142.20.61766 > 147.182.153.187.22: Flags [.], ack 0, win 5553, options [nop,nop,TS val 3412766309 ecr 1052717685], length 0
20:08:53.080253 IP 104.158.142.20.61766 > 147.182.153.187.22: Flags [.], ack 368, win 5549, options [nop,nop,TS val 3412766312 ecr 1052717688], length 0
20:08:53.155823 IP 147.182.153.187.22 > 104.158.142.20.61766: Flags [P.], seq 368:588, ack 1, win 501, options [nop,nop,TS val 1052717789 ecr 3412766312], length 220
20:08:53.155962 IP 147.182.153.187.22 > 104.158.142.20.61766: Flags [P.], seq 588:828, ack 1, win 501, options [nop,nop,TS val 1052717789 ecr 3412766312], length 240
20:08:53.156016 IP 147.182.153.187.22 > 104.158.142.20.61766: Flags [P.], seq 828:864, ack 1, win 501, options [nop,nop,TS val 1052717789 ecr 3412766312], length 36
20:08:53.156073 IP 147.182.153.187.22 > 104.158.142.20.61766: Flags [P.], seq 864:1068, ack 1, win 501, options [nop,nop,TS val 1052717789 ecr 3412766312], length 204
20:08:53.156101 IP 147.182.153.187.22 > 104.158.142.20.61766: Flags [P.], seq 1068:1104, ack 1, win 501, options [nop,nop,TS val 1052717789 ecr 3412766312], length 36
20:08:53.156139 IP 147.182.153.187.22 > 104.158.142.20.61766: Flags [P.], seq 1104:1308, ack 1, win 501, options [nop,nop,TS val 1052717789 ecr 3412766312], length 204
20:08:53.156165 IP 147.182.153.187.22 > 104.158.142.20.61766: Flags [P.], seq 1308:1344, ack 1, win 501, options [nop,nop,TS val 1052717789 ecr 3412766312], length 36
20:08:53.156233 IP 147.182.153.187.22 > 104.158.142.20.61766: Flags [P.], seq 1344:1532, ack 1, win 501, options [nop,nop,TS val 1052717789 ecr 3412766312], length 188
20:08:53.156263 IP 147.182.153.187.22 > 104.158.142.20.61766: Flags [P.], seq 1532:1568, ack 1, win 501, options [nop,nop,TS val 1052717789 ecr 3412766312], length 36
20:08:53.156299 IP 147.182.153.187.22 > 104.158.142.20.61766: Flags [P.], seq 1568:1756, ack 1, win 501, options [nop,nop,TS val 1052717789 ecr 3412766312], length 188
20:08:53.177035 IP 104.158.142.20.61766 > 147.182.153.187.22: Flags [.], ack 1756, win 5533, options [nop,nop,TS val 3412766414 ecr 1052717789], length 0
20:08:53.177092 IP 147.182.153.187.22 > 104.158.142.20.61766: Flags [P.], seq 1756:1792, ack 1, win 501, options [nop,nop,TS val 1052717810 ecr 3412766414], length 36
20:08:53.193754 IP 104.158.142.20.61766 > 147.182.153.187.22: Flags [.], ack 1792, win 5554, options [nop,nop,TS val 3412766433 ecr 1052717810], length 0
20:08:53.259783 IP 147.182.153.187.22 > 104.158.142.20.61766: Flags [P.], seq 1792:1996, ack 1, win 501, options [nop,nop,TS val 1052717893 ecr 3412766433], length 204
20:08:53.260046 IP 147.182.153.187.22 > 104.158.142.20.61766: Flags [P.], seq 1996:2032, ack 1, win 501, options [nop,nop,TS val 1052717893 ecr 3412766433], length 36
20:08:53.260140 IP 147.182.153.187.22 > 104.158.142.20.61766: Flags [P.], seq 2032:2236, ack 1, win 501, options [nop,nop,TS val 1052717893 ecr 3412766433], length 204
20:08:53.260183 IP 147.182.153.187.22 > 104.158.142.20.61766: Flags [P.], seq 2236:2272, ack 1, win 501, options [nop,nop,TS val 1052717893 ecr 3412766433], length 36
20:08:53.260241 IP 147.182.153.187.22 > 104.158.142.20.61766: Flags [P.], seq 2272:2476, ack 1, win 501, options [nop,nop,TS val 1052717893 ecr 3412766433], length 204
20:08:53.260281 IP 147.182.153.187.22 > 104.158.142.20.61766: Flags [P.], seq 2476:2512, ack 1, win 501, options [nop,nop,TS val 1052717893 ecr 3412766433], length 36
20:08:53.260332 IP 147.182.153.187.22 > 104.158.142.20.61766: Flags [P.], seq 2512:2716, ack 1, win 501, options [nop,nop,TS val 1052717893 ecr 3412766433], length 204
20:08:53.260402 IP 147.182.153.187.22 > 104.158.142.20.61766: Flags [P.], seq 2716:2956, ack 1, win 501, options [nop,nop,TS val 1052717893 ecr 3412766433], length 240
20:08:53.260441 IP 147.182.153.187.22 > 104.158.142.20.61766: Flags [P.], seq 2956:2992, ack 1, win 501, options [nop,nop,TS val 1052717893 ecr 3412766433], length 36
20:08:53.260497 IP 147.182.153.187.22 > 104.158.142.20.61766: Flags [P.], seq 2992:3196, ack 1, win 501, options [nop,nop,TS val 1052717894 ecr 3412766433], length 204
20:08:53.260537 IP 147.182.153.187.22 > 104.158.142.20.61766: Flags [P.], seq 3196:3232, ack 1, win 501, options [nop,nop,TS val 1052717894 ecr 3412766433], length 36
20:08:53.260596 IP 147.182.153.187.22 > 104.158.142.20.61766: Flags [P.], seq 3232:3436, ack 1, win 501, options [nop,nop,TS val 1052717894 ecr 3412766433], length 204
20:08:53.260639 IP 147.182.153.187.22 > 104.158.142.20.61766: Flags [P.], seq 3436:3472, ack 1, win 501, options [nop,nop,TS val 1052717894 ecr 3412766433], length 36
20:08:53.260695 IP 147.182.153.187.22 > 104.158.142.20.61766: Flags [P.], seq 3472:3676, ack 1, win 501, options [nop,nop,TS val 1052717894 ecr 3412766433], length 204
20:08:53.260769 IP 147.182.153.187.22 > 104.158.142.20.61766: Flags [P.], seq 3676:3916, ack 1, win 501, options [nop,nop,TS val 1052717894 ecr 3412766433], length 240
20:08:53.260818 IP 147.182.153.187.22 > 104.158.142.20.61766: Flags [P.], seq 3916:3952, ack 1, win 501, options [nop,nop,TS val 1052717894 ecr 3412766433], length 36
20:08:53.260905 IP 147.182.153.187.22 > 104.158.142.20.61766: Flags [P.], seq 3952:4156, ack 1, win 501, options [nop,nop,TS val 1052717894 ecr 3412766433], length 204
20:08:53.260946 IP 147.182.153.187.22 > 104.158.142.20.61766: Flags [P.], seq 4156:4192, ack 1, win 501, options [nop,nop,TS val 1052717894 ecr 3412766433], length 36
20:08:53.261002 IP 147.182.153.187.22 > 104.158.142.20.61766: Flags [P.], seq 4192:4380, ack 1, win 501, options [nop,nop,TS val 1052717894 ecr 3412766433], length 188
20:08:53.261041 IP 147.182.153.187.22 > 104.158.142.20.61766: Flags [P.], seq 4380:4416, ack 1, win 501, options [nop,nop,TS val 1052717894 ecr 3412766433], length 36
20:08:53.281903 IP 104.158.142.20.61766 > 147.182.153.187.22: Flags [.], ack 4416, win 5513, options [nop,nop,TS val 3412766518 ecr 1052717894], length 0
20:08:53.281990 IP 147.182.153.187.22 > 104.158.142.20.61766: Flags [P.], seq 4416:4880, ack 1, win 501, options [nop,nop,TS val 1052717915 ecr 3412766518], length 464
20:08:53.301730 IP 104.158.142.20.61766 > 147.182.153.187.22: Flags [.], ack 4880, win 5547, options [nop,nop,TS val 3412766538 ecr 1052717915], length 0
20:08:53.363758 IP 147.182.153.187.22 > 104.158.142.20.61766: Flags [P.], seq 4880:5084, ack 1, win 501, options [nop,nop,TS val 1052717997 ecr 3412766538], length 204
20:08:53.364007 IP 147.182.153.187.22 > 104.158.142.20.61766: Flags [P.], seq 5084:5120, ack 1, win 501, options [nop,nop,TS val 1052717997 ecr 3412766538], length 36
20:08:53.364119 IP 147.182.153.187.22 > 104.158.142.20.61766: Flags [P.], seq 5120:5324, ack 1, win 501, options [nop,nop,TS val 1052717997 ecr 3412766538], length 204
20:08:53.364164 IP 147.182.153.187.22 > 104.158.142.20.61766: Flags [P.], seq 5324:5360, ack 1, win 501, options [nop,nop,TS val 1052717997 ecr 3412766538], length 36
20:08:53.364227 IP 147.182.153.187.22 > 104.158.142.20.61766: Flags [P.], seq 5360:5564, ack 1, win 501, options [nop,nop,TS val 1052717997 ecr 3412766538], length 204
20:08:53.364265 IP 147.182.153.187.22 > 104.158.142.20.61766: Flags [P.], seq 5564:5600, ack 1, win 501, options [nop,nop,TS val 1052717997 ecr 3412766538], length 36
20:08:53.364316 IP 147.182.153.187.22 > 104.158.142.20.61766: Flags [P.], seq 5600:5804, ack 1, win 501, options [nop,nop,TS val 1052717997 ecr 3412766538], length 204
20:08:53.364346 IP 147.182.153.187.22 > 104.158.142.20.61766: Flags [P.], seq 5804:5840, ack 1, win 501, options [nop,nop,TS val 1052717997 ecr 3412766538], length 36
20:08:53.364389 IP 147.182.153.187.22 > 104.158.142.20.61766: Flags [P.], seq 5840:6044, ack 1, win 501, options [nop,nop,TS val 1052717997 ecr 3412766538], length 204
20:08:53.364419 IP 147.182.153.187.22 > 104.158.142.20.61766: Flags [P.], seq 6044:6080, ack 1, win 501, options [nop,nop,TS val 1052717997 ecr 3412766538], length 36
20:08:53.364459 IP 147.182.153.187.22 > 104.158.142.20.61766: Flags [P.], seq 6080:6284, ack 1, win 501, options [nop,nop,TS val 1052717997 ecr 3412766538], length 204
20:08:53.364489 IP 147.182.153.187.22 > 104.158.142.20.61766: Flags [P.], seq 6284:6320, ack 1, win 501, options [nop,nop,TS val 1052717998 ecr 3412766538], length 36
20:08:53.364528 IP 147.182.153.187.22 > 104.158.142.20.61766: Flags [P.], seq 6320:6524, ack 1, win 501, options [nop,nop,TS val 1052717998 ecr 3412766538], length 204
20:08:53.364558 IP 147.182.153.187.22 > 104.158.142.20.61766: Flags [P.], seq 6524:6560, ack 1, win 501, options [nop,nop,TS val 1052717998 ecr 3412766538], length 36
20:08:53.364597 IP 147.182.153.187.22 > 104.158.142.20.61766: Flags [P.], seq 6560:6764, ack 1, win 501, options [nop,nop,TS val 1052717998 ecr 3412766538], length 204
20:08:53.364625 IP 147.182.153.187.22 > 104.158.142.20.61766: Flags [P.], seq 6764:6800, ack 1, win 501, options [nop,nop,TS val 1052717998 ecr 3412766538], length 36
20:08:53.364664 IP 147.182.153.187.22 > 104.158.142.20.61766: Flags [P.], seq 6800:7004, ack 1, win 501, options [nop,nop,TS val 1052717998 ecr 3412766538], length 204
20:08:53.364694 IP 147.182.153.187.22 > 104.158.142.20.61766: Flags [P.], seq 7004:7040, ack 1, win 501, options [nop,nop,TS val 1052717998 ecr 3412766538], length 36
20:08:53.364733 IP 147.182.153.187.22 > 104.158.142.20.61766: Flags [P.], seq 7040:7244, ack 1, win 501, options [nop,nop,TS val 1052717998 ecr 3412766538], length 204
20:08:53.364779 IP 147.182.153.187.22 > 104.158.142.20.61766: Flags [P.], seq 7244:7280, ack 1, win 501, options [nop,nop,TS val 1052717998 ecr 3412766538], length 36
20:08:53.364824 IP 147.182.153.187.22 > 104.158.142.20.61766: Flags [P.], seq 7280:7484, ack 1, win 501, options [nop,nop,TS val 1052717998 ecr 3412766538], length 204
20:08:53.364853 IP 147.182.153.187.22 > 104.158.142.20.61766: Flags [P.], seq 7484:7520, ack 1, win 501, options [nop,nop,TS val 1052717998 ecr 3412766538], length 36
20:08:53.364892 IP 147.182.153.187.22 > 104.158.142.20.61766: Flags [P.], seq 7520:7724, ack 1, win 501, options [nop,nop,TS val 1052717998 ecr 3412766538], length 204
20:08:53.364924 IP 147.182.153.187.22 > 104.158.142.20.61766: Flags [P.], seq 7724:7760, ack 1, win 501, options [nop,nop,TS val 1052717998 ecr 3412766538], length 36
20:08:53.364964 IP 147.182.153.187.22 > 104.158.142.20.61766: Flags [P.], seq 7760:7964, ack 1, win 501, options [nop,nop,TS val 1052717998 ecr 3412766538], length 204
20:08:53.364994 IP 147.182.153.187.22 > 104.158.142.20.61766: Flags [P.], seq 7964:8000, ack 1, win 501, options [nop,nop,TS val 1052717998 ecr 3412766538], length 36
20:08:53.365032 IP 147.182.153.187.22 > 104.158.142.20.61766: Flags [P.], seq 8000:8204, ack 1, win 501, options [nop,nop,TS val 1052717998 ecr 3412766538], length 204
20:08:53.365061 IP 147.182.153.187.22 > 104.158.142.20.61766: Flags [P.], seq 8204:8240, ack 1, win 501, options [nop,nop,TS val 1052717998 ecr 3412766538], length 36
20:08:53.365099 IP 147.182.153.187.22 > 104.158.142.20.61766: Flags [P.], seq 8240:8444, ack 1, win 501, options [nop,nop,TS val 1052717998 ecr 3412766538], length 204
20:08:53.365128 IP 147.182.153.187.22 > 104.158.142.20.61766: Flags [P.], seq 8444:8480, ack 1, win 501, options [nop,nop,TS val 1052717998 ecr 3412766538], length 36
20:08:53.365166 IP 147.182.153.187.22 > 104.158.142.20.61766: Flags [P.], seq 8480:8684, ack 1, win 501, options [nop,nop,TS val 1052717998 ecr 3412766538], length 204
20:08:53.365195 IP 147.182.153.187.22 > 104.158.142.20.61766: Flags [P.], seq 8684:8720, ack 1, win 501, options [nop,nop,TS val 1052717998 ecr 3412766538], length 36
20:08:53.365234 IP 147.182.153.187.22 > 104.158.142.20.61766: Flags [P.], seq 8720:8924, ack 1, win 501, options [nop,nop,TS val 1052717998 ecr 3412766538], length 204
20:08:53.365264 IP 147.182.153.187.22 > 104.158.142.20.61766: Flags [P.], seq 8924:8960, ack 1, win 501, options [nop,nop,TS val 1052717998 ecr 3412766538], length 36
20:08:53.365315 IP 147.182.153.187.22 > 104.158.142.20.61766: Flags [P.], seq 8960:9164, ack 1, win 501, options [nop,nop,TS val 1052717998 ecr 3412766538], length 204
20:08:53.365344 IP 147.182.153.187.22 > 104.158.142.20.61766: Flags [P.], seq 9164:9200, ack 1, win 501, options [nop,nop,TS val 1052717998 ecr 3412766538], length 36
20:08:53.365382 IP 147.182.153.187.22 > 104.158.142.20.61766: Flags [P.], seq 9200:9404, ack 1, win 501, options [nop,nop,TS val 1052717998 ecr 3412766538], length 204
20:08:53.365411 IP 147.182.153.187.22 > 104.158.142.20.61766: Flags [P.], seq 9404:9440, ack 1, win 501, options [nop,nop,TS val 1052717998 ecr 3412766538], length 36
20:08:53.365450 IP 147.182.153.187.22 > 104.158.142.20.61766: Flags [P.], seq 9440:9644, ack 1, win 501, options [nop,nop,TS val 1052717998 ecr 3412766538], length 204
20:08:53.365479 IP 147.182.153.187.22 > 104.158.142.20.61766: Flags [P.], seq 9644:9680, ack 1, win 501, options [nop,nop,TS val 1052717999 ecr 3412766538], length 36
20:08:53.382105 IP 104.158.142.20.61766 > 147.182.153.187.22: Flags [.], ack 9680, win 5479, options [nop,nop,TS val 3412766621 ecr 1052717999], length 0
20:08:53.382106 IP 104.158.142.20.61766 > 147.182.153.187.22: Flags [.], ack 9680, win 5554, options [nop,nop,TS val 3412766621 ecr 1052717999], length 0
20:08:53.382198 IP 147.182.153.187.22 > 104.158.142.20.61766: Flags [P.], seq 9680:10368, ack 1, win 501, options [nop,nop,TS val 1052718015 ecr 3412766621], length 688
20:08:53.401886 IP 104.158.142.20.61766 > 147.182.153.187.22: Flags [.], ack 10368, win 5544, options [nop,nop,TS val 3412766639 ecr 1052718015], length 0
20:08:53.467986 IP 147.182.153.187.22 > 104.158.142.20.61766: Flags [P.], seq 10368:10572, ack 1, win 501, options [nop,nop,TS val 1052718101 ecr 3412766639], length 204
20:08:53.468124 IP 147.182.153.187.22 > 104.158.142.20.61766: Flags [P.], seq 10572:10608, ack 1, win 501, options [nop,nop,TS val 1052718101 ecr 3412766639], length 36
20:08:53.468145 IP 147.182.153.187.22 > 104.158.142.20.61766: Flags [P.], seq 10608:10812, ack 1, win 501, options [nop,nop,TS val 1052718101 ecr 3412766639], length 204
20:08:53.468173 IP 147.182.153.187.22 > 104.158.142.20.61766: Flags [P.], seq 10812:10848, ack 1, win 501, options [nop,nop,TS val 1052718101 ecr 3412766639], length 36
20:08:53.468212 IP 147.182.153.187.22 > 104.158.142.20.61766: Flags [P.], seq 10848:11052, ack 1, win 501, options [nop,nop,TS val 1052718101 ecr 3412766639], length 204
20:08:53.468253 IP 147.182.153.187.22 > 104.158.142.20.61766: Flags [P.], seq 11052:11088, ack 1, win 501, options [nop,nop,TS val 1052718101 ecr 3412766639], length 36
20:08:53.468292 IP 147.182.153.187.22 > 104.158.142.20.61766: Flags [P.], seq 11088:11292, ack 1, win 501, options [nop,nop,TS val 1052718101 ecr 3412766639], length 204
20:08:53.468319 IP 147.182.153.187.22 > 104.158.142.20.61766: Flags [P.], seq 11292:11328, ack 1, win 501, options [nop,nop,TS val 1052718101 ecr 3412766639], length 36
20:08:53.468384 IP 147.182.153.187.22 > 104.158.142.20.61766: Flags [P.], seq 11328:11532, ack 1, win 501, options [nop,nop,TS val 1052718101 ecr 3412766639], length 204
20:08:53.468412 IP 147.182.153.187.22 > 104.158.142.20.61766: Flags [P.], seq 11532:11568, ack 1, win 501, options [nop,nop,TS val 1052718101 ecr 3412766639], length 36
20:08:53.468449 IP 147.182.153.187.22 > 104.158.142.20.61766: Flags [P.], seq 11568:11772, ack 1, win 501, options [nop,nop,TS val 1052718101 ecr 3412766639], length 204
20:08:53.468475 IP 147.182.153.187.22 > 104.158.142.20.61766: Flags [P.], seq 11772:11808, ack 1, win 501, options [nop,nop,TS val 1052718102 ecr 3412766639], length 36
20:08:53.468511 IP 147.182.153.187.22 > 104.158.142.20.61766: Flags [P.], seq 11808:12012, ack 1, win 501, options [nop,nop,TS val 1052718102 ecr 3412766639], length 204
20:08:53.468538 IP 147.182.153.187.22 > 104.158.142.20.61766: Flags [P.], seq 12012:12048, ack 1, win 501, options [nop,nop,TS val 1052718102 ecr 3412766639], length 36
20:08:53.468574 IP 147.182.153.187.22 > 104.158.142.20.61766: Flags [P.], seq 12048:12252, ack 1, win 501, options [nop,nop,TS val 1052718102 ecr 3412766639], length 204
20:08:53.468601 IP 147.182.153.187.22 > 104.158.142.20.61766: Flags [P.], seq 12252:12288, ack 1, win 501, options [nop,nop,TS val 1052718102 ecr 3412766639], length 36
20:08:53.468638 IP 147.182.153.187.22 > 104.158.142.20.61766: Flags [P.], seq 12288:12492, ack 1, win 501, options [nop,nop,TS val 1052718102 ecr 3412766639], length 204
20:08:53.468664 IP 147.182.153.187.22 > 104.158.142.20.61766: Flags [P.], seq 12492:12528, ack 1, win 501, options [nop,nop,TS val 1052718102 ecr 3412766639], length 36
20:08:53.468700 IP 147.182.153.187.22 > 104.158.142.20.61766: Flags [P.], seq 12528:12732, ack 1, win 501, options [nop,nop,TS val 1052718102 ecr 3412766639], length 204
20:08:53.468728 IP 147.182.153.187.22 > 104.158.142.20.61766: Flags [P.], seq 12732:12768, ack 1, win 501, options [nop,nop,TS val 1052718102 ecr 3412766639], length 36
20:08:53.468764 IP 147.182.153.187.22 > 104.158.142.20.61766: Flags [P.], seq 12768:12972, ack 1, win 501, options [nop,nop,TS val 1052718102 ecr 3412766639], length 204
20:08:53.468790 IP 147.182.153.187.22 > 104.158.142.20.61766: Flags [P.], seq 12972:13008, ack 1, win 501, options [nop,nop,TS val 1052718102 ecr 3412766639], length 36
20:08:53.468836 IP 147.182.153.187.22 > 104.158.142.20.61766: Flags [P.], seq 13008:13212, ack 1, win 501, options [nop,nop,TS val 1052718102 ecr 3412766639], length 204
20:08:53.468863 IP 147.182.153.187.22 > 104.158.142.20.61766: Flags [P.], seq 13212:13248, ack 1, win 501, options [nop,nop,TS val 1052718102 ecr 3412766639], length 36
20:08:53.468899 IP 147.182.153.187.22 > 104.158.142.20.61766: Flags [P.], seq 13248:13452, ack 1, win 501, options [nop,nop,TS val 1052718102 ecr 3412766639], length 204
20:08:53.468925 IP 147.182.153.187.22 > 104.158.142.20.61766: Flags [P.], seq 13452:13488, ack 1, win 501, options [nop,nop,TS val 1052718102 ecr 3412766639], length 36
20:08:53.468961 IP 147.182.153.187.22 > 104.158.142.20.61766: Flags [P.], seq 13488:13692, ack 1, win 501, options [nop,nop,TS val 1052718102 ecr 3412766639], length 204
20:08:53.468987 IP 147.182.153.187.22 > 104.158.142.20.61766: Flags [P.], seq 13692:13728, ack 1, win 501, options [nop,nop,TS val 1052718102 ecr 3412766639], length 36
20:08:53.469023 IP 147.182.153.187.22 > 104.158.142.20.61766: Flags [P.], seq 13728:13932, ack 1, win 501, options [nop,nop,TS val 1052718102 ecr 3412766639], length 204
20:08:53.469049 IP 147.182.153.187.22 > 104.158.142.20.61766: Flags [P.], seq 13932:13968, ack 1, win 501, options [nop,nop,TS val 1052718102 ecr 3412766639], length 36
20:08:53.469099 IP 147.182.153.187.22 > 104.158.142.20.61766: Flags [P.], seq 13968:14172, ack 1, win 501, options [nop,nop,TS val 1052718102 ecr 3412766639], length 204
20:08:53.469139 IP 147.182.153.187.22 > 104.158.142.20.61766: Flags [P.], seq 14172:14208, ack 1, win 501, options [nop,nop,TS val 1052718102 ecr 3412766639], length 36
20:08:53.469180 IP 147.182.153.187.22 > 104.158.142.20.61766: Flags [P.], seq 14208:14412, ack 1, win 501, options [nop,nop,TS val 1052718102 ecr 3412766639], length 204
20:08:53.469208 IP 147.182.153.187.22 > 104.158.142.20.61766: Flags [P.], seq 14412:14448, ack 1, win 501, options [nop,nop,TS val 1052718102 ecr 3412766639], length 36
20:08:53.469244 IP 147.182.153.187.22 > 104.158.142.20.61766: Flags [P.], seq 14448:14652, ack 1, win 501, options [nop,nop,TS val 1052718102 ecr 3412766639], length 204
20:08:53.469270 IP 147.182.153.187.22 > 104.158.142.20.61766: Flags [P.], seq 14652:14688, ack 1, win 501, options [nop,nop,TS val 1052718102 ecr 3412766639], length 36
20:08:53.469306 IP 147.182.153.187.22 > 104.158.142.20.61766: Flags [P.], seq 14688:14892, ack 1, win 501, options [nop,nop,TS val 1052718102 ecr 3412766639], length 204
20:08:53.469333 IP 147.182.153.187.22 > 104.158.142.20.61766: Flags [P.], seq 14892:14928, ack 1, win 501, options [nop,nop,TS val 1052718102 ecr 3412766639], length 36
20:08:53.469368 IP 147.182.153.187.22 > 104.158.142.20.61766: Flags [P.], seq 14928:15132, ack 1, win 501, options [nop,nop,TS val 1052718102 ecr 3412766639], length 204
20:08:53.469395 IP 147.182.153.187.22 > 104.158.142.20.61766: Flags [P.], seq 15132:15168, ack 1, win 501, options [nop,nop,TS val 1052718102 ecr 3412766639], length 36
20:08:53.469431 IP 147.182.153.187.22 > 104.158.142.20.61766: Flags [P.], seq 15168:15372, ack 1, win 501, options [nop,nop,TS val 1052718102 ecr 3412766639], length 204
20:08:53.469458 IP 147.182.153.187.22 > 104.158.142.20.61766: Flags [P.], seq 15372:15408, ack 1, win 501, options [nop,nop,TS val 1052718102 ecr 3412766639], length 36
20:08:53.469493 IP 147.182.153.187.22 > 104.158.142.20.61766: Flags [P.], seq 15408:15612, ack 1, win 501, options [nop,nop,TS val 1052718103 ecr 3412766639], length 204
20:08:53.469523 IP 147.182.153.187.22 > 104.158.142.20.61766: Flags [P.], seq 15612:15648, ack 1, win 501, options [nop,nop,TS val 1052718103 ecr 3412766639], length 36
20:08:53.469560 IP 147.182.153.187.22 > 104.158.142.20.61766: Flags [P.], seq 15648:15852, ack 1, win 501, options [nop,nop,TS val 1052718103 ecr 3412766639], length 204
20:08:53.469590 IP 147.182.153.187.22 > 104.158.142.20.61766: Flags [P.], seq 15852:15888, ack 1, win 501, options [nop,nop,TS val 1052718103 ecr 3412766639], length 36
20:08:53.469624 IP 147.182.153.187.22 > 104.158.142.20.61766: Flags [P.], seq 15888:16092, ack 1, win 501, options [nop,nop,TS val 1052718103 ecr 3412766639], length 204
20:08:53.469650 IP 147.182.153.187.22 > 104.158.142.20.61766: Flags [P.], seq 16092:16128, ack 1, win 501, options [nop,nop,TS val 1052718103 ecr 3412766639], length 36
20:08:53.469687 IP 147.182.153.187.22 > 104.158.142.20.61766: Flags [P.], seq 16128:16332, ack 1, win 501, options [nop,nop,TS val 1052718103 ecr 3412766639], length 204
20:08:53.469714 IP 147.182.153.187.22 > 104.158.142.20.61766: Flags [P.], seq 16332:16368, ack 1, win 501, options [nop,nop,TS val 1052718103 ecr 3412766639], length 36
20:08:53.469750 IP 147.182.153.187.22 > 104.158.142.20.61766: Flags [P.], seq 16368:16572, ack 1, win 501, options [nop,nop,TS val 1052718103 ecr 3412766639], length 204
20:08:53.469777 IP 147.182.153.187.22 > 104.158.142.20.61766: Flags [P.], seq 16572:16608, ack 1, win 501, options [nop,nop,TS val 1052718103 ecr 3412766639], length 36
20:08:53.469812 IP 147.182.153.187.22 > 104.158.142.20.61766: Flags [P.], seq 16608:16812, ack 1, win 501, options [nop,nop,TS val 1052718103 ecr 3412766639], length 204
20:08:53.469838 IP 147.182.153.187.22 > 104.158.142.20.61766: Flags [P.], seq 16812:16848, ack 1, win 501, options [nop,nop,TS val 1052718103 ecr 3412766639], length 36
20:08:53.469874 IP 147.182.153.187.22 > 104.158.142.20.61766: Flags [P.], seq 16848:17052, ack 1, win 501, options [nop,nop,TS val 1052718103 ecr 3412766639], length 204
20:08:53.469900 IP 147.182.153.187.22 > 104.158.142.20.61766: Flags [P.], seq 17052:17088, ack 1, win 501, options [nop,nop,TS val 1052718103 ecr 3412766639], length 36
20:08:53.469936 IP 147.182.153.187.22 > 104.158.142.20.61766: Flags [P.], seq 17088:17292, ack 1, win 501, options [nop,nop,TS val 1052718103 ecr 3412766639], length 204
20:08:53.469964 IP 147.182.153.187.22 > 104.158.142.20.61766: Flags [P.], seq 17292:17328, ack 1, win 501, options [nop,nop,TS val 1052718103 ecr 3412766639], length 36
20:08:53.470000 IP 147.182.153.187.22 > 104.158.142.20.61766: Flags [P.], seq 17328:17532, ack 1, win 501, options [nop,nop,TS val 1052718103 ecr 3412766639], length 204
20:08:53.470026 IP 147.182.153.187.22 > 104.158.142.20.61766: Flags [P.], seq 17532:17568, ack 1, win 501, options [nop,nop,TS val 1052718103 ecr 3412766639], length 36
20:08:53.470061 IP 147.182.153.187.22 > 104.158.142.20.61766: Flags [P.], seq 17568:17772, ack 1, win 501, options [nop,nop,TS val 1052718103 ecr 3412766639], length 204
20:08:53.470098 IP 147.182.153.187.22 > 104.158.142.20.61766: Flags [P.], seq 17772:17808, ack 1, win 501, options [nop,nop,TS val 1052718103 ecr 3412766639], length 36
20:08:53.470155 IP 147.182.153.187.22 > 104.158.142.20.61766: Flags [P.], seq 17808:18012, ack 1, win 501, options [nop,nop,TS val 1052718103 ecr 3412766639], length 204
20:08:53.470208 IP 147.182.153.187.22 > 104.158.142.20.61766: Flags [P.], seq 18012:18048, ack 1, win 501, options [nop,nop,TS val 1052718103 ecr 3412766639], length 36
20:08:53.470258 IP 147.182.153.187.22 > 104.158.142.20.61766: Flags [P.], seq 18048:18252, ack 1, win 501, options [nop,nop,TS val 1052718103 ecr 3412766639], length 204
20:08:53.470291 IP 147.182.153.187.22 > 104.158.142.20.61766: Flags [P.], seq 18252:18288, ack 1, win 501, options [nop,nop,TS val 1052718103 ecr 3412766639], length 36
20:08:53.470347 IP 147.182.153.187.22 > 104.158.142.20.61766: Flags [P.], seq 18288:18492, ack 1, win 501, options [nop,nop,TS val 1052718103 ecr 3412766639], length 204
20:08:53.470390 IP 147.182.153.187.22 > 104.158.142.20.61766: Flags [P.], seq 18492:18528, ack 1, win 501, options [nop,nop,TS val 1052718103 ecr 3412766639], length 36
20:08:53.470420 IP 147.182.153.187.22 > 104.158.142.20.61766: Flags [P.], seq 18528:18732, ack 1, win 501, options [nop,nop,TS val 1052718103 ecr 3412766639], length 204
20:08:53.470507 IP 147.182.153.187.22 > 104.158.142.20.61766: Flags [P.], seq 18732:18768, ack 1, win 501, options [nop,nop,TS val 1052718104 ecr 3412766639], length 36
20:08:53.470556 IP 147.182.153.187.22 > 104.158.142.20.61766: Flags [P.], seq 18768:18972, ack 1, win 501, options [nop,nop,TS val 1052718104 ecr 3412766639], length 204
20:08:53.470640 IP 147.182.153.187.22 > 104.158.142.20.61766: Flags [P.], seq 18972:19248, ack 1, win 501, options [nop,nop,TS val 1052718104 ecr 3412766639], length 276
20:08:53.470713 IP 147.182.153.187.22 > 104.158.142.20.61766: Flags [P.], seq 19248:19692, ack 1, win 501, options [nop,nop,TS val 1052718104 ecr 3412766639], length 444
20:08:53.470745 IP 147.182.153.187.22 > 104.158.142.20.61766: Flags [P.], seq 19692:19728, ack 1, win 501, options [nop,nop,TS val 1052718104 ecr 3412766639], length 36
20:08:53.470811 IP 147.182.153.187.22 > 104.158.142.20.61766: Flags [P.], seq 19728:19932, ack 1, win 501, options [nop,nop,TS val 1052718104 ecr 3412766639], length 204
20:08:53.470858 IP 147.182.153.187.22 > 104.158.142.20.61766: Flags [P.], seq 19932:19968, ack 1, win 501, options [nop,nop,TS val 1052718104 ecr 3412766639], length 36
20:08:53.470925 IP 147.182.153.187.22 > 104.158.142.20.61766: Flags [P.], seq 19968:20156, ack 1, win 501, options [nop,nop,TS val 1052718104 ecr 3412766639], length 188
20:08:53.470969 IP 147.182.153.187.22 > 104.158.142.20.61766: Flags [P.], seq 20156:20192, ack 1, win 501, options [nop,nop,TS val 1052718104 ecr 3412766639], length 36
20:08:53.471025 IP 147.182.153.187.22 > 104.158.142.20.61766: Flags [P.], seq 20192:20380, ack 1, win 501, options [nop,nop,TS val 1052718104 ecr 3412766639], length 188
20:08:53.471058 IP 147.182.153.187.22 > 104.158.142.20.61766: Flags [P.], seq 20380:20416, ack 1, win 501, options [nop,nop,TS val 1052718104 ecr 3412766639], length 36
20:08:53.488457 IP 104.158.142.20.61766 > 147.182.153.187.22: Flags [.], ack 14208, win 5494, options [nop,nop,TS val 3412766725 ecr 1052718102], length 0
20:08:53.488457 IP 104.158.142.20.61766 > 147.182.153.187.22: Flags [.], ack 14208, win 5554, options [nop,nop,TS val 3412766725 ecr 1052718102], length 0
20:08:53.488527 IP 147.182.153.187.22 > 104.158.142.20.61766: Flags [P.], seq 20416:20880, ack 1, win 501, options [nop,nop,TS val 1052718122 ecr 3412766725], length 464
20:08:53.494709 IP 104.158.142.20.61766 > 147.182.153.187.22: Flags [.], ack 20416, win 5457, options [nop,nop,TS val 3412766726 ecr 1052718104], length 0
20:08:53.494709 IP 104.158.142.20.61766 > 147.182.153.187.22: Flags [.], ack 20416, win 5554, options [nop,nop,TS val 3412766726 ecr 1052718104], length 0
20:08:53.501932 IP 104.158.142.20.61766 > 147.182.153.187.22: Flags [P.], seq 1:37, ack 20416, win 5554, options [nop,nop,TS val 3412766734 ecr 1052718104], length 36
20:08:53.510306 IP 104.158.142.20.61766 > 147.182.153.187.22: Flags [.], ack 20880, win 5547, options [nop,nop,TS val 3412766745 ecr 1052718122], length 0
20:08:53.543552 IP 147.182.153.187.22 > 104.158.142.20.61766: Flags [.], ack 37, win 501, options [nop,nop,TS val 1052718177 ecr 3412766734], length 0
20:08:53.571800 IP 147.182.153.187.22 > 104.158.142.20.61766: Flags [P.], seq 20880:21084, ack 37, win 501, options [nop,nop,TS val 1052718205 ecr 3412766734], length 204
20:08:53.572161 IP 147.182.153.187.22 > 104.158.142.20.61766: Flags [P.], seq 21084:21120, ack 37, win 501, options [nop,nop,TS val 1052718205 ecr 3412766734], length 36
20:08:53.572280 IP 147.182.153.187.22 > 104.158.142.20.61766: Flags [P.], seq 21120:21324, ack 37, win 501, options [nop,nop,TS val 1052718205 ecr 3412766734], length 204
20:08:53.572357 IP 147.182.153.187.22 > 104.158.142.20.61766: Flags [P.], seq 21324:21564, ack 37, win 501, options [nop,nop,TS val 1052718205 ecr 3412766734], length 240
20:08:53.572537 IP 147.182.153.187.22 > 104.158.142.20.61766: Flags [P.], seq 21564:22284, ack 37, win 501, options [nop,nop,TS val 1052718206 ecr 3412766734], length 720
20:08:53.572563 IP 147.182.153.187.22 > 104.158.142.20.61766: Flags [P.], seq 22284:22320, ack 37, win 501, options [nop,nop,TS val 1052718206 ecr 3412766734], length 36
20:08:53.572615 IP 147.182.153.187.22 > 104.158.142.20.61766: Flags [P.], seq 22320:22524, ack 37, win 501, options [nop,nop,TS val 1052718206 ecr 3412766734], length 204
20:08:53.572651 IP 147.182.153.187.22 > 104.158.142.20.61766: Flags [P.], seq 22524:22560, ack 37, win 501, options [nop,nop,TS val 1052718206 ecr 3412766734], length 36
20:08:53.572702 IP 147.182.153.187.22 > 104.158.142.20.61766: Flags [P.], seq 22560:22764, ack 37, win 501, options [nop,nop,TS val 1052718206 ecr 3412766734], length 204
20:08:53.572781 IP 147.182.153.187.22 > 104.158.142.20.61766: Flags [P.], seq 22764:23144, ack 37, win 501, options [nop,nop,TS val 1052718206 ecr 3412766734], length 380
20:08:53.572858 IP 147.182.153.187.22 > 104.158.142.20.61766: Flags [P.], seq 23144:23524, ack 37, win 501, options [nop,nop,TS val 1052718206 ecr 3412766734], length 380
20:08:53.572960 IP 147.182.153.187.22 > 104.158.142.20.61766: Flags [P.], seq 23524:24072, ack 37, win 501, options [nop,nop,TS val 1052718206 ecr 3412766734], length 548
20:08:53.573039 IP 147.182.153.187.22 > 104.158.142.20.61766: Flags [P.], seq 24072:24452, ack 37, win 501, options [nop,nop,TS val 1052718206 ecr 3412766734], length 380
20:08:53.573119 IP 147.182.153.187.22 > 104.158.142.20.61766: Flags [P.], seq 24452:24832, ack 37, win 501, options [nop,nop,TS val 1052718206 ecr 3412766734], length 380
20:08:53.573212 IP 147.182.153.187.22 > 104.158.142.20.61766: Flags [P.], seq 24832:25380, ack 37, win 501, options [nop,nop,TS val 1052718206 ecr 3412766734], length 548
20:08:53.573293 IP 147.182.153.187.22 > 104.158.142.20.61766: Flags [P.], seq 25380:25760, ack 37, win 501, options [nop,nop,TS val 1052718206 ecr 3412766734], length 380
20:08:53.573380 IP 147.182.153.187.22 > 104.158.142.20.61766: Flags [P.], seq 25760:26308, ack 37, win 501, options [nop,nop,TS val 1052718206 ecr 3412766734], length 548
20:08:53.573453 IP 147.182.153.187.22 > 104.158.142.20.61766: Flags [P.], seq 26308:26688, ack 37, win 501, options [nop,nop,TS val 1052718206 ecr 3412766734], length 380
20:08:53.573528 IP 147.182.153.187.22 > 104.158.142.20.61766: Flags [P.], seq 26688:27068, ack 37, win 501, options [nop,nop,TS val 1052718207 ecr 3412766734], length 380
20:08:53.573599 IP 147.182.153.187.22 > 104.158.142.20.61766: Flags [P.], seq 27068:27448, ack 37, win 501, options [nop,nop,TS val 1052718207 ecr 3412766734], length 380
20:08:53.573691 IP 147.182.153.187.22 > 104.158.142.20.61766: Flags [P.], seq 27448:27996, ack 37, win 501, options [nop,nop,TS val 1052718207 ecr 3412766734], length 548
20:08:53.573797 IP 147.182.153.187.22 > 104.158.142.20.61766: Flags [P.], seq 27996:28376, ack 37, win 501, options [nop,nop,TS val 1052718207 ecr 3412766734], length 380
20:08:53.573878 IP 147.182.153.187.22 > 104.158.142.20.61766: Flags [P.], seq 28376:28792, ack 37, win 501, options [nop,nop,TS val 1052718207 ecr 3412766734], length 416
20:08:53.573935 IP 147.182.153.187.22 > 104.158.142.20.61766: Flags [P.], seq 28792:28996, ack 37, win 501, options [nop,nop,TS val 1052718207 ecr 3412766734], length 204
20:08:53.574016 IP 147.182.153.187.22 > 104.158.142.20.61766: Flags [P.], seq 28996:29376, ack 37, win 501, options [nop,nop,TS val 1052718207 ecr 3412766734], length 380
20:08:53.574105 IP 147.182.153.187.22 > 104.158.142.20.61766: Flags [P.], seq 29376:29924, ack 37, win 501, options [nop,nop,TS val 1052718207 ecr 3412766734], length 548
20:08:53.574178 IP 147.182.153.187.22 > 104.158.142.20.61766: Flags [P.], seq 29924:30304, ack 37, win 501, options [nop,nop,TS val 1052718207 ecr 3412766734], length 380
20:08:53.574269 IP 147.182.153.187.22 > 104.158.142.20.61766: Flags [P.], seq 30304:30852, ack 37, win 501, options [nop,nop,TS val 1052718207 ecr 3412766734], length 548
20:08:53.574346 IP 147.182.153.187.22 > 104.158.142.20.61766: Flags [P.], seq 30852:31232, ack 37, win 501, options [nop,nop,TS val 1052718207 ecr 3412766734], length 380
20:08:53.574424 IP 147.182.153.187.22 > 104.158.142.20.61766: Flags [P.], seq 31232:31612, ack 37, win 501, options [nop,nop,TS val 1052718207 ecr 3412766734], length 380
20:08:53.574501 IP 147.182.153.187.22 > 104.158.142.20.61766: Flags [P.], seq 31612:31992, ack 37, win 501, options [nop,nop,TS val 1052718208 ecr 3412766734], length 380
20:08:53.574589 IP 147.182.153.187.22 > 104.158.142.20.61766: Flags [P.], seq 31992:32540, ack 37, win 501, options [nop,nop,TS val 1052718208 ecr 3412766734], length 548
20:08:53.574651 IP 147.182.153.187.22 > 104.158.142.20.61766: Flags [P.], seq 32540:32752, ack 37, win 501, options [nop,nop,TS val 1052718208 ecr 3412766734], length 212
20:08:53.574730 IP 147.182.153.187.22 > 104.158.142.20.61766: Flags [P.], seq 32752:33132, ack 37, win 501, options [nop,nop,TS val 1052718208 ecr 3412766734], length 380
20:08:53.574808 IP 147.182.153.187.22 > 104.158.142.20.61766: Flags [P.], seq 33132:33512, ack 37, win 501, options [nop,nop,TS val 1052718208 ecr 3412766734], length 380
20:08:53.574887 IP 147.182.153.187.22 > 104.158.142.20.61766: Flags [P.], seq 33512:33892, ack 37, win 501, options [nop,nop,TS val 1052718208 ecr 3412766734], length 380
20:08:53.574972 IP 147.182.153.187.22 > 104.158.142.20.61766: Flags [P.], seq 33892:34440, ack 37, win 501, options [nop,nop,TS val 1052718208 ecr 3412766734], length 548
20:08:53.575032 IP 147.182.153.187.22 > 104.158.142.20.61766: Flags [P.], seq 34440:34652, ack 37, win 501, options [nop,nop,TS val 1052718208 ecr 3412766734], length 212
20:08:53.575111 IP 147.182.153.187.22 > 104.158.142.20.61766: Flags [P.], seq 34652:35032, ack 37, win 501, options [nop,nop,TS val 1052718208 ecr 3412766734], length 380
20:08:53.575223 IP 147.182.153.187.22 > 104.158.142.20.61766: Flags [P.], seq 35032:35412, ack 37, win 501, options [nop,nop,TS val 1052718208 ecr 3412766734], length 380
20:08:53.575361 IP 147.182.153.187.22 > 104.158.142.20.61766: Flags [P.], seq 35412:36296, ack 37, win 501, options [nop,nop,TS val 1052718208 ecr 3412766734], length 884
20:08:53.575446 IP 147.182.153.187.22 > 104.158.142.20.61766: Flags [P.], seq 36296:36820, ack 37, win 501, options [nop,nop,TS val 1052718208 ecr 3412766734], length 524
20:08:53.575624 IP 147.182.153.187.22 > 104.158.142.20.61766: Flags [P.], seq 36820:37648, ack 37, win 501, options [nop,nop,TS val 1052718209 ecr 3412766734], length 828
20:08:53.593962 IP 104.158.142.20.61766 > 147.182.153.187.22: Flags [.], ack 26688, win 5464, options [nop,nop,TS val 3412766830 ecr 1052718206], length 0
20:08:53.594015 IP 104.158.142.20.61766 > 147.182.153.187.22: Flags [.], ack 26688, win 5554, options [nop,nop,TS val 3412766830 ecr 1052718206], length 0
20:08:53.598478 IP 104.158.142.20.61766 > 147.182.153.187.22: Flags [.], ack 37648, win 5383, options [nop,nop,TS val 3412766832 ecr 1052718209], length 0
20:08:53.598479 IP 104.158.142.20.61766 > 147.182.153.187.22: Flags [.], ack 37648, win 5554, options [nop,nop,TS val 3412766832 ecr 1052718209], length 0
20:08:53.675747 IP 147.182.153.187.22 > 104.158.142.20.61766: Flags [P.], seq 37648:37852, ack 37, win 501, options [nop,nop,TS val 1052718309 ecr 3412766832], length 204
20:08:53.675983 IP 147.182.153.187.22 > 104.158.142.20.61766: Flags [P.], seq 37852:38408, ack 37, win 501, options [nop,nop,TS val 1052718309 ecr 3412766832], length 556
20:08:53.676029 IP 147.182.153.187.22 > 104.158.142.20.61766: Flags [P.], seq 38408:38444, ack 37, win 501, options [nop,nop,TS val 1052718309 ecr 3412766832], length 36
20:08:53.676078 IP 147.182.153.187.22 > 104.158.142.20.61766: Flags [P.], seq 38444:38648, ack 37, win 501, options [nop,nop,TS val 1052718309 ecr 3412766832], length 204
20:08:53.676111 IP 147.182.153.187.22 > 104.158.142.20.61766: Flags [P.], seq 38648:38684, ack 37, win 501, options [nop,nop,TS val 1052718309 ecr 3412766832], length 36
20:08:53.676170 IP 147.182.153.187.22 > 104.158.142.20.61766: Flags [P.], seq 38684:39064, ack 37, win 501, options [nop,nop,TS val 1052718309 ecr 3412766832], length 380
20:08:53.676231 IP 147.182.153.187.22 > 104.158.142.20.61766: Flags [P.], seq 39064:39444, ack 37, win 501, options [nop,nop,TS val 1052718309 ecr 3412766832], length 380
20:08:53.676290 IP 147.182.153.187.22 > 104.158.142.20.61766: Flags [P.], seq 39444:39824, ack 37, win 501, options [nop,nop,TS val 1052718309 ecr 3412766832], length 380
20:08:53.676367 IP 147.182.153.187.22 > 104.158.142.20.61766: Flags [P.], seq 39824:40204, ack 37, win 501, options [nop,nop,TS val 1052718309 ecr 3412766832], length 380
20:08:53.676451 IP 147.182.153.187.22 > 104.158.142.20.61766: Flags [P.], seq 40204:40584, ack 37, win 501, options [nop,nop,TS val 1052718309 ecr 3412766832], length 380
20:08:53.676501 IP 147.182.153.187.22 > 104.158.142.20.61766: Flags [P.], seq 40584:40620, ack 37, win 501, options [nop,nop,TS val 1052718310 ecr 3412766832], length 36
20:08:53.676605 IP 147.182.153.187.22 > 104.158.142.20.61766: Flags [P.], seq 40620:40824, ack 37, win 501, options [nop,nop,TS val 1052718310 ecr 3412766832], length 204
20:08:53.676734 IP 147.182.153.187.22 > 104.158.142.20.61766: Flags [P.], seq 40824:41380, ack 37, win 501, options [nop,nop,TS val 1052718310 ecr 3412766832], length 556
20:08:53.676845 IP 147.182.153.187.22 > 104.158.142.20.61766: Flags [P.], seq 41380:42104, ack 37, win 501, options [nop,nop,TS val 1052718310 ecr 3412766832], length 724
20:08:53.676923 IP 147.182.153.187.22 > 104.158.142.20.61766: Flags [P.], seq 42104:42828, ack 37, win 501, options [nop,nop,TS val 1052718310 ecr 3412766832], length 724
20:08:53.676985 IP 147.182.153.187.22 > 104.158.142.20.61766: Flags [P.], seq 42828:43376, ack 37, win 501, options [nop,nop,TS val 1052718310 ecr 3412766832], length 548
20:08:53.677038 IP 147.182.153.187.22 > 104.158.142.20.61766: Flags [P.], seq 43376:43756, ack 37, win 501, options [nop,nop,TS val 1052718310 ecr 3412766832], length 380
20:08:53.677101 IP 147.182.153.187.22 > 104.158.142.20.61766: Flags [P.], seq 43756:44312, ack 37, win 501, options [nop,nop,TS val 1052718310 ecr 3412766832], length 556
20:08:53.677151 IP 147.182.153.187.22 > 104.158.142.20.61766: Flags [P.], seq 44312:44524, ack 37, win 501, options [nop,nop,TS val 1052718310 ecr 3412766832], length 212
20:08:53.677215 IP 147.182.153.187.22 > 104.158.142.20.61766: Flags [P.], seq 44524:45080, ack 37, win 501, options [nop,nop,TS val 1052718310 ecr 3412766832], length 556
20:08:53.677268 IP 147.182.153.187.22 > 104.158.142.20.61766: Flags [P.], seq 45080:45460, ack 37, win 501, options [nop,nop,TS val 1052718310 ecr 3412766832], length 380
20:08:53.677347 IP 147.182.153.187.22 > 104.158.142.20.61766: Flags [P.], seq 45460:45840, ack 37, win 501, options [nop,nop,TS val 1052718310 ecr 3412766832], length 380
20:08:53.677443 IP 147.182.153.187.22 > 104.158.142.20.61766: Flags [P.], seq 45840:46188, ack 37, win 501, options [nop,nop,TS val 1052718310 ecr 3412766832], length 348
20:08:53.677535 IP 147.182.153.187.22 > 104.158.142.20.61766: Flags [P.], seq 46188:46536, ack 37, win 501, options [nop,nop,TS val 1052718311 ecr 3412766832], length 348
20:08:53.677621 IP 147.182.153.187.22 > 104.158.142.20.61766: Flags [P.], seq 46536:46572, ack 37, win 501, options [nop,nop,TS val 1052718311 ecr 3412766832], length 36
20:08:53.697441 IP 104.158.142.20.61766 > 147.182.153.187.22: Flags [.], ack 46572, win 5415, options [nop,nop,TS val 3412766934 ecr 1052718311], length 0
20:08:53.697441 IP 104.158.142.20.61766 > 147.182.153.187.22: Flags [.], ack 46572, win 5554, options [nop,nop,TS val 3412766934 ecr 1052718311], length 0
20:08:53.779733 IP 147.182.153.187.22 > 104.158.142.20.61766: Flags [P.], seq 46572:46776, ack 37, win 501, options [nop,nop,TS val 1052718413 ecr 3412766934], length 204
20:08:53.780039 IP 147.182.153.187.22 > 104.158.142.20.61766: Flags [P.], seq 46776:47332, ack 37, win 501, options [nop,nop,TS val 1052718413 ecr 3412766934], length 556
20:08:53.780381 IP 147.182.153.187.22 > 104.158.142.20.61766: Flags [P.], seq 47332:51296, ack 37, win 501, options [nop,nop,TS val 1052718413 ecr 3412766934], length 3964
20:08:53.799789 IP 104.158.142.20.61766 > 147.182.153.187.22: Flags [.], ack 48780, win 5554, options [nop,nop,TS val 3412767036 ecr 1052718413], length 0
20:08:53.805153 IP 104.158.142.20.61766 > 147.182.153.187.22: Flags [.], ack 51296, win 5554, options [nop,nop,TS val 3412767037 ecr 1052718413], length 0
20:08:53.883817 IP 147.182.153.187.22 > 104.158.142.20.61766: Flags [P.], seq 51296:51500, ack 37, win 501, options [nop,nop,TS val 1052718517 ecr 3412767037], length 204
20:08:53.884154 IP 147.182.153.187.22 > 104.158.142.20.61766: Flags [P.], seq 51500:52200, ack 37, win 501, options [nop,nop,TS val 1052718517 ecr 3412767037], length 700
20:08:53.901787 IP 104.158.142.20.61766 > 147.182.153.187.22: Flags [.], ack 52200, win 5554, options [nop,nop,TS val 3412767140 ecr 1052718517], length 0
20:08:53.987812 IP 147.182.153.187.22 > 104.158.142.20.61766: Flags [P.], seq 52200:52740, ack 37, win 501, options [nop,nop,TS val 1052718621 ecr 3412767140], length 540
20:08:54.006537 IP 104.158.142.20.61766 > 147.182.153.187.22: Flags [.], ack 52740, win 5554, options [nop,nop,TS val 3412767244 ecr 1052718621], length 0
20:08:54.091820 IP 147.182.153.187.22 > 104.158.142.20.61766: Flags [P.], seq 52740:53104, ack 37, win 501, options [nop,nop,TS val 1052718725 ecr 3412767244], length 364
20:08:54.118795 IP 104.158.142.20.61766 > 147.182.153.187.22: Flags [.], ack 53104, win 5554, options [nop,nop,TS val 3412767349 ecr 1052718725], length 0
20:08:54.195765 IP 147.182.153.187.22 > 104.158.142.20.61766: Flags [P.], seq 53104:53468, ack 37, win 501, options [nop,nop,TS val 1052718829 ecr 3412767349], length 364
20:08:54.214715 IP 104.158.142.20.61766 > 147.182.153.187.22: Flags [.], ack 53468, win 5554, options [nop,nop,TS val 3412767452 ecr 1052718829], length 0
20:08:54.299739 IP 147.182.153.187.22 > 104.158.142.20.61766: Flags [P.], seq 53468:53832, ack 37, win 501, options [nop,nop,TS val 1052718933 ecr 3412767452], length 364
20:08:54.318287 IP 104.158.142.20.61766 > 147.182.153.187.22: Flags [.], ack 53832, win 5554, options [nop,nop,TS val 3412767556 ecr 1052718933], length 0
264 packets captured
267 packets received by filter
0 packets dropped by kernel