root@comp3134-lab:~# tcpdump -i eth0
tcpdump: verbose output suppressed, use -v[v]... for full protocol decode
listening on eth0, link-type EN10MB (Ethernet), snapshot length 262144 bytes
20:02:36.400848 IP comp3134-lab.ssh > 20.142.158.104.in-addr.arpa.61766: Flags [P.], seq 669342769:669342877, ack 3704286643, win 501, options [nop,nop,TS val 1052341034 ecr 3412389616], length 108
20:02:36.400944 IP comp3134-lab.ssh > 20.142.158.104.in-addr.arpa.61766: Flags [P.], seq 108:264, ack 1, win 501, options [nop,nop,TS val 1052341034 ecr 3412389616], length 156
20:02:36.400981 IP comp3134-lab.ssh > 20.142.158.104.in-addr.arpa.61766: Flags [P.], seq 264:332, ack 1, win 501, options [nop,nop,TS val 1052341034 ecr 3412389616], length 68
20:02:36.401010 IP comp3134-lab.ssh > 20.142.158.104.in-addr.arpa.61766: Flags [P.], seq 332:368, ack 1, win 501, options [nop,nop,TS val 1052341034 ecr 3412389616], length 36
20:02:36.405677 IP 20.142.158.104.in-addr.arpa.61766 > comp3134-lab.ssh: Flags [.], ack 0, win 2047, options [nop,nop,TS val 3412389635 ecr 1052341020], length 0
20:02:36.426504 IP 20.142.158.104.in-addr.arpa.61766 > comp3134-lab.ssh: Flags [.], ack 368, win 2042, options [nop,nop,TS val 3412389650 ecr 1052341034], length 0
20:02:36.500913 IP comp3134-lab.40985 > 67.207.67.2.domain: 4302+ [1au] PTR? 20.142.158.104.in-addr.arpa. (56)
20:02:36.501034 IP comp3134-lab.37390 > 67.207.67.2.domain: 10161+ [1au] PTR? 20.142.158.104.in-addr.arpa. (56)
20:02:36.501098 IP comp3134-lab.40580 > 67.207.67.2.domain: Flags [S], seq 288747214, win 64240, options [mss 1460,sackOK,TS val 1406779828 ecr 0,nop,wscale 7,tfo  cookiereq,nop,nop], length 0
20:02:36.503089 IP 67.207.67.2.domain > comp3134-lab.40580: Flags [S.], seq 1076139547, ack 288747215, win 65160, options [mss 1460,sackOK,TS val 1242831450 ecr 1406779828,nop,wscale 9], length 0
20:02:36.503151 IP comp3134-lab.40580 > 67.207.67.2.domain: Flags [.], ack 1, win 502, options [nop,nop,TS val 1406779830 ecr 1242831450], length 0
20:02:36.503481 IP comp3134-lab.40580 > 67.207.67.2.domain: Flags [P.], seq 1:48, ack 1, win 502, options [nop,nop,TS val 1406779830 ecr 1242831450], length 47 6906+ PTR? 20.142.158.104.in-addr.arpa. (45)
20:02:36.504754 IP 67.207.67.2.domain > comp3134-lab.40580: Flags [.], ack 48, win 128, options [nop,nop,TS val 1242831452 ecr 1406779830], length 0
20:02:36.515750 IP 67.207.67.2.domain > comp3134-lab.40580: Flags [P.], seq 1:62, ack 48, win 128, options [nop,nop,TS val 1242831463 ecr 1406779830], length 61 6906 1/0/0 PTR 20.142.158.104.in-addr.arpa. (59)
20:02:36.515805 IP comp3134-lab.40580 > 67.207.67.2.domain: Flags [.], ack 62, win 502, options [nop,nop,TS val 1406779843 ecr 1242831463], length 0
20:02:36.516255 IP 67.207.67.2.domain > comp3134-lab.37390: 10161 1/0/1 PTR 20.142.158.104.in-addr.arpa. (70)
20:02:36.516291 IP 67.207.67.2.domain > comp3134-lab.40985: 4302 1/0/1 PTR 20.142.158.104.in-addr.arpa. (70)
20:02:36.516763 IP comp3134-lab.52656 > 67.207.67.2.domain: 25173+ [1au] PTR? 187.153.182.147.in-addr.arpa. (57)
20:02:36.537071 IP 67.207.67.2.domain > comp3134-lab.52656: 25173 NXDomain 0/1/1 (124)
20:02:36.537249 IP comp3134-lab.52656 > 67.207.67.2.domain: 25173+ PTR? 187.153.182.147.in-addr.arpa. (46)
20:02:36.556131 IP 67.207.67.2.domain > comp3134-lab.52656: 25173 NXDomain 0/1/0 (113)
20:02:36.557035 IP comp3134-lab.ssh > 20.142.158.104.in-addr.arpa.61766: Flags [P.], seq 368:604, ack 1, win 501, options [nop,nop,TS val 1052341190 ecr 3412389650], length 236